Date soumission,Commercial,Entrepreneur,Entreprise,Q1 - Colere fondatrice,Q2 - Origine du nom,Q3 - Mission,Q4 - Avant (enfer),Q4 - Apres (paradis),Q5 - Ennemi commun,Q6 - Peur secrete,Q7 - Preuve d'autorite,Q8 - Secret sauce,Q9 - Rituel,Q10 - 3 adjectifs,Q11 - Anti-portrait,Q12 - Ton verbal,Q13 - Ambiance visuelle,Q14 - Couleurs et matieres,Q15 - Curseur food porn,Q16 - Ambition franchise,Q17 - Mantra
05/03/2026 09:35:14,Strict Food's,Foy / Lesniak,RD FITNESS,"L'envie de pouvoir manger rapidement, un burger par exemple, après ou avant une séance, sans culpabiliser.","Strict dans un premier temps pour le jeu de mots avec Street : Strict food / street food. 
Le terme strict c'est avant tout pour montrer une certaine hygiène de vie, un sérieux dans son alimentation au quotidien mais a côté de cela, on se fait plaisir avec un burger. ","Il manquerait un endroit ou l'on peut se faire plaisir, se régaler, et il faudrait donc pour les personnes un peu soucieuse de leur alimentation se tourner vers les fast foods classiques ","Il se demande ou il va pouvoir manger rapidement, copieusement sans culpabiliser et se dire qu'il aura faim dans 2/3 heures.","Il est content, il a passé un bon moment avec nous, il a manger quelque chose de qualité pleins de saveurs et il sait qu'il a pas ""détruit"" sa diète. ","L'ennemi commun, c'est les fast foods classiques, des produits avec peu ou pas de qualité, relativement cher pour ce qu'on mange et qui sont remplis de gras. ","C'est le côté ""protéine"" qui je pense fait peur. On pense que c'est seulement réservé a certaines personnes, des sportifs, alors que non. ","Boucherie Labourde. Baptiste est un ami, influent sur les réseaux, il propose de bon produits. 
Les pains du Soleil. Une des meilleurs boulangerie de Perpignan.
Myfitcheese. Du fromage hyperproteiné pour remplacer le fromage classique.",Toutes les cuissons sont faites aux Airfryer. ,"Le restaurant est très convivial de part nos personnalités. 
Nous avons une grande cuisine ouverte ou tout le monde peut nous voir.",,,"On essaye vite d'employer le tutoiement, mettre à l'aise. On parle avec des mots simples, mais si il faut, on explique.","Si c'était une marque de vêtements, Gymshark
Une voiture, un G63","Les couleurs, sobres, du noir, du blanc. 
Les matières, du bois, très floral.","7/10 . Il faut que le burger donne envie, mais qu'il y est ce coté moins gras, qu'on sente que c'est le burger sain/healthy.","Dans 5 ans, il faut 4/5 points de ventes. Rien à dire de plus.",j'adore : le cheat meal qui n'en est pas un. 